{
  "name": "BLU-PC",
  "os": "Microsoft 10.0.26100",
  "ipv4": [
    "100.100.1.50",
    "172.29.176.1",
    "192.168.2.22",
    "192.168.2.50",
    "192.168.2.51"
  ],
  "ipv6": [
    "fd7a:115c:a1e0::fb01:be24"
  ],
  "macs": [
    "D8-BB-C1-1C-CA-0D",
    "00-15-5D-D7-61-51",
    "BC-30-7D-6F-35-85",
    "D8-BB-C1-1C-CA-0C",
    "D8-BB-C1-1C-CA-0D",
    "78-20-00-2B-C1-F1"
  ],
  "http": [],
  "https": [],
  "ssh": [],
  "vnc": [],
  "rdp": [],
  "tcp": [],
  "udp": []
}
